[
  {
    "id": "PUB-001",
    "scope": "Public",
    "name": "Accueil public CNPM",
    "route": "/",
    "template": "PublicLanding",
    "priority": "P0",
    "roles": "Public",
    "reference": "REF-PUB-001",
    "status": "Specifie",
    "notes": ""
  },
  {
    "id": "PUB-002",
    "scope": "Public",
    "name": "Presentation du CNPM",
    "route": "/le-cnpm",
    "template": "PublicContent",
    "priority": "P1",
    "roles": "Public",
    "reference": "",
    "status": "Specifie",
    "notes": ""
  },
  {
    "id": "PUB-003",
    "scope": "Public",
    "name": "Services du CNPM",
    "route": "/services",
    "template": "PublicContent",
    "priority": "P1",
    "roles": "Public",
    "reference": "",
    "status": "Specifie",
    "notes": ""
  },
  {
    "id": "PUB-004",
    "scope": "Public",
    "name": "Annuaire public des membres",
    "route": "/membres",
    "template": "PublicDirectory",
    "priority": "P0",
    "roles": "Public",
    "reference": "",
    "status": "Specifie",
    "notes": ""
  },
  {
    "id": "PUB-005",
    "scope": "Public",
    "name": "Recherche et filtres annuaire",
    "route": "/membres/recherche",
    "template": "PublicDirectory",
    "priority": "P1",
    "roles": "Public",
    "reference": "",
    "status": "Specifie",
    "notes": ""
  },
  {
    "id": "PUB-006",
    "scope": "Public",
    "name": "Vitrine publique d un membre",
    "route": "/membres/:slug",
    "template": "MemberShowcase",
    "priority": "P0",
    "roles": "Public",
    "reference": "REF-PUB-006",
    "status": "Specifie",
    "notes": ""
  },
  {
    "id": "PUB-007",
    "scope": "Public",
    "name": "Liste des activites et projets du membre",
    "route": "/membres/:slug/activites",
    "template": "MemberShowcase",
    "priority": "P1",
    "roles": "Public",
    "reference": "",
    "status": "Specifie",
    "notes": ""
  },
  {
    "id": "PUB-008",
    "scope": "Public",
    "name": "Detail d une realisation du membre",
    "route": "/membres/:slug/realisations/:id",
    "template": "MemberShowcaseDetail",
    "priority": "P1",
    "roles": "Public",
    "reference": "",
    "status": "Specifie",
    "notes": ""
  },
  {
    "id": "PUB-009",
    "scope": "Public",
    "name": "Actualites CNPM",
    "route": "/actualites",
    "template": "PublicListing",
    "priority": "P1",
    "roles": "Public",
    "reference": "",
    "status": "Specifie",
    "notes": ""
  },
  {
    "id": "PUB-010",
    "scope": "Public",
    "name": "Detail actualite",
    "route": "/actualites/:slug",
    "template": "PublicContent",
    "priority": "P1",
    "roles": "Public",
    "reference": "",
    "status": "Specifie",
    "notes": ""
  },
  {
    "id": "PUB-011",
    "scope": "Public",
    "name": "Agenda et evenements",
    "route": "/agenda",
    "template": "PublicListing",
    "priority": "P1",
    "roles": "Public",
    "reference": "",
    "status": "Specifie",
    "notes": ""
  },
  {
    "id": "PUB-012",
    "scope": "Public",
    "name": "Demande d adhesion publique",
    "route": "/adhesion",
    "template": "PublicForm",
    "priority": "P0",
    "roles": "Prospect",
    "reference": "",
    "status": "Specifie",
    "notes": ""
  },
  {
    "id": "PUB-013",
    "scope": "Public",
    "name": "Confirmation demande adhesion",
    "route": "/adhesion/confirmation",
    "template": "PublicConfirmation",
    "priority": "P0",
    "roles": "Prospect",
    "reference": "",
    "status": "Specifie",
    "notes": ""
  },
  {
    "id": "PUB-014",
    "scope": "Public",
    "name": "Contact CNPM",
    "route": "/contact",
    "template": "PublicForm",
    "priority": "P1",
    "roles": "Public",
    "reference": "",
    "status": "Specifie",
    "notes": ""
  },
  {
    "id": "PUB-015",
    "scope": "Public",
    "name": "Verification publique d un recu",
    "route": "/verification/:code",
    "template": "PublicVerification",
    "priority": "P0",
    "roles": "Public",
    "reference": "",
    "status": "Specifie",
    "notes": ""
  },
  {
    "id": "PUB-016",
    "scope": "Public",
    "name": "Mentions legales et confidentialite",
    "route": "/legal/:document",
    "template": "PublicContent",
    "priority": "P1",
    "roles": "Public",
    "reference": "",
    "status": "Specifie",
    "notes": ""
  },
  {
    "id": "AUTH-001",
    "scope": "Authentification",
    "name": "Connexion administration / membre",
    "route": "/auth/login",
    "template": "AuthSplit",
    "priority": "P0",
    "roles": "Tous",
    "reference": "REF-AUTH-001",
    "status": "Specifie",
    "notes": ""
  },
  {
    "id": "AUTH-002",
    "scope": "Authentification",
    "name": "Saisie du code 2FA",
    "route": "/auth/verify",
    "template": "AuthSplit",
    "priority": "P0",
    "roles": "Tous",
    "reference": "REF-AUTH-001",
    "status": "Specifie",
    "notes": ""
  },
  {
    "id": "AUTH-003",
    "scope": "Authentification",
    "name": "Choix de methode 2FA",
    "route": "/auth/verify/method",
    "template": "AuthCentered",
    "priority": "P0",
    "roles": "Tous",
    "reference": "",
    "status": "Specifie",
    "notes": ""
  },
  {
    "id": "AUTH-004",
    "scope": "Authentification",
    "name": "Mot de passe oublie",
    "route": "/auth/forgot-password",
    "template": "AuthCentered",
    "priority": "P0",
    "roles": "Tous",
    "reference": "",
    "status": "Specifie",
    "notes": ""
  },
  {
    "id": "AUTH-005",
    "scope": "Authentification",
    "name": "Reinitialiser le mot de passe",
    "route": "/auth/reset-password",
    "template": "AuthCentered",
    "priority": "P0",
    "roles": "Tous",
    "reference": "",
    "status": "Specifie",
    "notes": ""
  },
  {
    "id": "AUTH-006",
    "scope": "Authentification",
    "name": "Activation du compte",
    "route": "/auth/activate",
    "template": "AuthCentered",
    "priority": "P0",
    "roles": "Tous",
    "reference": "",
    "status": "Specifie",
    "notes": ""
  },
  {
    "id": "AUTH-007",
    "scope": "Authentification",
    "name": "Enrolement TOTP / passkey",
    "route": "/auth/2fa-enrollment",
    "template": "AuthCentered",
    "priority": "P1",
    "roles": "Tous",
    "reference": "",
    "status": "Specifie",
    "notes": ""
  },
  {
    "id": "AUTH-008",
    "scope": "Authentification",
    "name": "Session expiree / acces refuse",
    "route": "/auth/session-ended",
    "template": "AuthCentered",
    "priority": "P0",
    "roles": "Tous",
    "reference": "",
    "status": "Specifie",
    "notes": ""
  },
  {
    "id": "BO-001",
    "scope": "Back-office",
    "name": "Tableau de bord operationnel",
    "route": "/admin/dashboard",
    "template": "AdminDashboard",
    "priority": "P0",
    "roles": "Direction, Finance, Recouvrement",
    "reference": "REF-BO-001",
    "status": "Specifie",
    "notes": ""
  },
  {
    "id": "BO-002",
    "scope": "Back-office",
    "name": "Liste des membres",
    "route": "/admin/members",
    "template": "AdminTable",
    "priority": "P0",
    "roles": "Gestionnaire, Recouvrement",
    "reference": "REF-BO-002",
    "status": "Specifie",
    "notes": ""
  },
  {
    "id": "BO-003",
    "scope": "Back-office",
    "name": "Fiche membre 360 degres",
    "route": "/admin/members/:id",
    "template": "AdminEntityDetail",
    "priority": "P0",
    "roles": "Gestionnaire, Recouvrement",
    "reference": "REF-BO-003",
    "status": "Specifie",
    "notes": ""
  },
  {
    "id": "BO-004",
    "scope": "Back-office",
    "name": "Creation / modification membre",
    "route": "/admin/members/:id/edit",
    "template": "AdminForm",
    "priority": "P0",
    "roles": "Gestionnaire",
    "reference": "",
    "status": "Specifie",
    "notes": ""
  },
  {
    "id": "BO-005",
    "scope": "Back-office",
    "name": "Liste des entreprises",
    "route": "/admin/organizations",
    "template": "AdminTable",
    "priority": "P0",
    "roles": "Gestionnaire",
    "reference": "",
    "status": "Specifie",
    "notes": ""
  },
  {
    "id": "BO-006",
    "scope": "Back-office",
    "name": "Fiche entreprise",
    "route": "/admin/organizations/:id",
    "template": "AdminEntityDetail",
    "priority": "P0",
    "roles": "Gestionnaire",
    "reference": "",
    "status": "Specifie",
    "notes": ""
  },
  {
    "id": "BO-007",
    "scope": "Back-office",
    "name": "Gestion des contacts",
    "route": "/admin/organizations/:id/contacts",
    "template": "AdminTable",
    "priority": "P1",
    "roles": "Gestionnaire",
    "reference": "",
    "status": "Specifie",
    "notes": ""
  },
  {
    "id": "BO-008",
    "scope": "Back-office",
    "name": "Liste des enrôlements",
    "route": "/admin/enrollments",
    "template": "AdminTable",
    "priority": "P0",
    "roles": "Validateur, Gestionnaire",
    "reference": "",
    "status": "Specifie",
    "notes": ""
  },
  {
    "id": "BO-009",
    "scope": "Back-office",
    "name": "Nouvel enrôlement multi-etapes",
    "route": "/admin/enrollments/new",
    "template": "AdminWizard",
    "priority": "P0",
    "roles": "Gestionnaire",
    "reference": "REF-BO-009",
    "status": "Specifie",
    "notes": ""
  },
  {
    "id": "BO-010",
    "scope": "Back-office",
    "name": "Validation d un enrôlement",
    "route": "/admin/enrollments/:id/review",
    "template": "AdminReview",
    "priority": "P0",
    "roles": "Validateur",
    "reference": "",
    "status": "Specifie",
    "notes": ""
  },
  {
    "id": "BO-011",
    "scope": "Back-office",
    "name": "Cotisations et echeanciers",
    "route": "/admin/contributions",
    "template": "AdminFinance",
    "priority": "P0",
    "roles": "Finance, Comptable",
    "reference": "REF-BO-011",
    "status": "Specifie",
    "notes": ""
  },
  {
    "id": "BO-012",
    "scope": "Back-office",
    "name": "Generation des appels",
    "route": "/admin/contributions/calls/new",
    "template": "AdminWizard",
    "priority": "P0",
    "roles": "Finance",
    "reference": "",
    "status": "Specifie",